[
	{
		"item_id": "ipip-neo-300-001",
		"domain": "N",
		"facet": "N1",
		"keying": "plus"
	},
	{
		"item_id": "ipip-neo-300-002",
		"domain": "N",
		"facet": "N1",
		"keying": "plus"
	},
	{
		"item_id": "ipip-neo-300-003",
		"domain": "N",
		"facet": "N1",
		"keying": "plus"
	},
	{
		"item_id": "ipip-neo-300-004",
		"domain": "N",
		"facet": "N1",
		"keying": "plus"
	},
	{
		"item_id": "ipip-neo-300-005",
		"domain": "N",
		"facet": "N1",
		"keying": "plus"
	},
	{
		"item_id": "ipip-neo-300-006",
		"domain": "N",
		"facet": "N1",
		"keying": "minus"
	},
	{
		"item_id": "ipip-neo-300-007",
		"domain": "N",
		"facet": "N1",
		"keying": "minus"
	},
	{
		"item_id": "ipip-neo-300-008",
		"domain": "N",
		"facet": "N1",
		"keying": "minus"
	},
	{
		"item_id": "ipip-neo-300-009",
		"domain": "N",
		"facet": "N1",
		"keying": "minus"
	},
	{
		"item_id": "ipip-neo-300-010",
		"domain": "N",
		"facet": "N1",
		"keying": "minus"
	},
	{
		"item_id": "ipip-neo-300-011",
		"domain": "N",
		"facet": "N2",
		"keying": "plus"
	},
	{
		"item_id": "ipip-neo-300-012",
		"domain": "N",
		"facet": "N2",
		"keying": "plus"
	},
	{
		"item_id": "ipip-neo-300-013",
		"domain": "N",
		"facet": "N2",
		"keying": "plus"
	},
	{
		"item_id": "ipip-neo-300-014",
		"domain": "N",
		"facet": "N2",
		"keying": "plus"
	},
	{
		"item_id": "ipip-neo-300-015",
		"domain": "N",
		"facet": "N2",
		"keying": "plus"
	},
	{
		"item_id": "ipip-neo-300-016",
		"domain": "N",
		"facet": "N2",
		"keying": "minus"
	},
	{
		"item_id": "ipip-neo-300-017",
		"domain": "N",
		"facet": "N2",
		"keying": "minus"
	},
	{
		"item_id": "ipip-neo-300-018",
		"domain": "N",
		"facet": "N2",
		"keying": "minus"
	},
	{
		"item_id": "ipip-neo-300-019",
		"domain": "N",
		"facet": "N2",
		"keying": "minus"
	},
	{
		"item_id": "ipip-neo-300-020",
		"domain": "N",
		"facet": "N2",
		"keying": "minus"
	},
	{
		"item_id": "ipip-neo-300-021",
		"domain": "N",
		"facet": "N3",
		"keying": "plus"
	},
	{
		"item_id": "ipip-neo-300-022",
		"domain": "N",
		"facet": "N3",
		"keying": "plus"
	},
	{
		"item_id": "ipip-neo-300-023",
		"domain": "N",
		"facet": "N3",
		"keying": "plus"
	},
	{
		"item_id": "ipip-neo-300-024",
		"domain": "N",
		"facet": "N3",
		"keying": "plus"
	},
	{
		"item_id": "ipip-neo-300-025",
		"domain": "N",
		"facet": "N3",
		"keying": "plus"
	},
	{
		"item_id": "ipip-neo-300-026",
		"domain": "N",
		"facet": "N3",
		"keying": "plus"
	},
	{
		"item_id": "ipip-neo-300-027",
		"domain": "N",
		"facet": "N3",
		"keying": "plus"
	},
	{
		"item_id": "ipip-neo-300-028",
		"domain": "N",
		"facet": "N3",
		"keying": "minus"
	},
	{
		"item_id": "ipip-neo-300-029",
		"domain": "N",
		"facet": "N3",
		"keying": "minus"
	},
	{
		"item_id": "ipip-neo-300-030",
		"domain": "N",
		"facet": "N3",
		"keying": "minus"
	},
	{
		"item_id": "ipip-neo-300-031",
		"domain": "N",
		"facet": "N4",
		"keying": "plus"
	},
	{
		"item_id": "ipip-neo-300-032",
		"domain": "N",
		"facet": "N4",
		"keying": "plus"
	},
	{
		"item_id": "ipip-neo-300-033",
		"domain": "N",
		"facet": "N4",
		"keying": "plus"
	},
	{
		"item_id": "ipip-neo-300-034",
		"domain": "N",
		"facet": "N4",
		"keying": "plus"
	},
	{
		"item_id": "ipip-neo-300-035",
		"domain": "N",
		"facet": "N4",
		"keying": "plus"
	},
	{
		"item_id": "ipip-neo-300-036",
		"domain": "N",
		"facet": "N4",
		"keying": "plus"
	},
	{
		"item_id": "ipip-neo-300-037",
		"domain": "N",
		"facet": "N4",
		"keying": "minus"
	},
	{
		"item_id": "ipip-neo-300-038",
		"domain": "N",
		"facet": "N4",
		"keying": "minus"
	},
	{
		"item_id": "ipip-neo-300-039",
		"domain": "N",
		"facet": "N4",
		"keying": "minus"
	},
	{
		"item_id": "ipip-neo-300-040",
		"domain": "N",
		"facet": "N4",
		"keying": "minus"
	},
	{
		"item_id": "ipip-neo-300-041",
		"domain": "N",
		"facet": "N5",
		"keying": "plus"
	},
	{
		"item_id": "ipip-neo-300-042",
		"domain": "N",
		"facet": "N5",
		"keying": "plus"
	},
	{
		"item_id": "ipip-neo-300-043",
		"domain": "N",
		"facet": "N5",
		"keying": "plus"
	},
	{
		"item_id": "ipip-neo-300-044",
		"domain": "N",
		"facet": "N5",
		"keying": "plus"
	},
	{
		"item_id": "ipip-neo-300-045",
		"domain": "N",
		"facet": "N5",
		"keying": "plus"
	},
	{
		"item_id": "ipip-neo-300-046",
		"domain": "N",
		"facet": "N5",
		"keying": "minus"
	},
	{
		"item_id": "ipip-neo-300-047",
		"domain": "N",
		"facet": "N5",
		"keying": "minus"
	},
	{
		"item_id": "ipip-neo-300-048",
		"domain": "N",
		"facet": "N5",
		"keying": "minus"
	},
	{
		"item_id": "ipip-neo-300-049",
		"domain": "N",
		"facet": "N5",
		"keying": "minus"
	},
	{
		"item_id": "ipip-neo-300-050",
		"domain": "N",
		"facet": "N5",
		"keying": "minus"
	},
	{
		"item_id": "ipip-neo-300-051",
		"domain": "N",
		"facet": "N6",
		"keying": "plus"
	},
	{
		"item_id": "ipip-neo-300-052",
		"domain": "N",
		"facet": "N6",
		"keying": "plus"
	},
	{
		"item_id": "ipip-neo-300-053",
		"domain": "N",
		"facet": "N6",
		"keying": "plus"
	},
	{
		"item_id": "ipip-neo-300-054",
		"domain": "N",
		"facet": "N6",
		"keying": "plus"
	},
	{
		"item_id": "ipip-neo-300-055",
		"domain": "N",
		"facet": "N6",
		"keying": "plus"
	},
	{
		"item_id": "ipip-neo-300-056",
		"domain": "N",
		"facet": "N6",
		"keying": "minus"
	},
	{
		"item_id": "ipip-neo-300-057",
		"domain": "N",
		"facet": "N6",
		"keying": "minus"
	},
	{
		"item_id": "ipip-neo-300-058",
		"domain": "N",
		"facet": "N6",
		"keying": "minus"
	},
	{
		"item_id": "ipip-neo-300-059",
		"domain": "N",
		"facet": "N6",
		"keying": "minus"
	},
	{
		"item_id": "ipip-neo-300-060",
		"domain": "N",
		"facet": "N6",
		"keying": "minus"
	},
	{
		"item_id": "ipip-neo-300-061",
		"domain": "E",
		"facet": "E1",
		"keying": "plus"
	},
	{
		"item_id": "ipip-neo-300-062",
		"domain": "E",
		"facet": "E1",
		"keying": "plus"
	},
	{
		"item_id": "ipip-neo-300-063",
		"domain": "E",
		"facet": "E1",
		"keying": "plus"
	},
	{
		"item_id": "ipip-neo-300-064",
		"domain": "E",
		"facet": "E1",
		"keying": "plus"
	},
	{
		"item_id": "ipip-neo-300-065",
		"domain": "E",
		"facet": "E1",
		"keying": "plus"
	},
	{
		"item_id": "ipip-neo-300-066",
		"domain": "E",
		"facet": "E1",
		"keying": "minus"
	},
	{
		"item_id": "ipip-neo-300-067",
		"domain": "E",
		"facet": "E1",
		"keying": "minus"
	},
	{
		"item_id": "ipip-neo-300-068",
		"domain": "E",
		"facet": "E1",
		"keying": "minus"
	},
	{
		"item_id": "ipip-neo-300-069",
		"domain": "E",
		"facet": "E1",
		"keying": "minus"
	},
	{
		"item_id": "ipip-neo-300-070",
		"domain": "E",
		"facet": "E1",
		"keying": "minus"
	},
	{
		"item_id": "ipip-neo-300-071",
		"domain": "E",
		"facet": "E2",
		"keying": "plus"
	},
	{
		"item_id": "ipip-neo-300-072",
		"domain": "E",
		"facet": "E2",
		"keying": "plus"
	},
	{
		"item_id": "ipip-neo-300-073",
		"domain": "E",
		"facet": "E2",
		"keying": "plus"
	},
	{
		"item_id": "ipip-neo-300-074",
		"domain": "E",
		"facet": "E2",
		"keying": "plus"
	},
	{
		"item_id": "ipip-neo-300-075",
		"domain": "E",
		"facet": "E2",
		"keying": "plus"
	},
	{
		"item_id": "ipip-neo-300-076",
		"domain": "E",
		"facet": "E2",
		"keying": "minus"
	},
	{
		"item_id": "ipip-neo-300-077",
		"domain": "E",
		"facet": "E2",
		"keying": "minus"
	},
	{
		"item_id": "ipip-neo-300-078",
		"domain": "E",
		"facet": "E2",
		"keying": "minus"
	},
	{
		"item_id": "ipip-neo-300-079",
		"domain": "E",
		"facet": "E2",
		"keying": "minus"
	},
	{
		"item_id": "ipip-neo-300-080",
		"domain": "E",
		"facet": "E2",
		"keying": "minus"
	},
	{
		"item_id": "ipip-neo-300-081",
		"domain": "E",
		"facet": "E3",
		"keying": "plus"
	},
	{
		"item_id": "ipip-neo-300-082",
		"domain": "E",
		"facet": "E3",
		"keying": "plus"
	},
	{
		"item_id": "ipip-neo-300-083",
		"domain": "E",
		"facet": "E3",
		"keying": "plus"
	},
	{
		"item_id": "ipip-neo-300-084",
		"domain": "E",
		"facet": "E3",
		"keying": "plus"
	},
	{
		"item_id": "ipip-neo-300-085",
		"domain": "E",
		"facet": "E3",
		"keying": "plus"
	},
	{
		"item_id": "ipip-neo-300-086",
		"domain": "E",
		"facet": "E3",
		"keying": "minus"
	},
	{
		"item_id": "ipip-neo-300-087",
		"domain": "E",
		"facet": "E3",
		"keying": "minus"
	},
	{
		"item_id": "ipip-neo-300-088",
		"domain": "E",
		"facet": "E3",
		"keying": "minus"
	},
	{
		"item_id": "ipip-neo-300-089",
		"domain": "E",
		"facet": "E3",
		"keying": "minus"
	},
	{
		"item_id": "ipip-neo-300-090",
		"domain": "E",
		"facet": "E3",
		"keying": "minus"
	},
	{
		"item_id": "ipip-neo-300-091",
		"domain": "E",
		"facet": "E4",
		"keying": "plus"
	},
	{
		"item_id": "ipip-neo-300-092",
		"domain": "E",
		"facet": "E4",
		"keying": "plus"
	},
	{
		"item_id": "ipip-neo-300-093",
		"domain": "E",
		"facet": "E4",
		"keying": "plus"
	},
	{
		"item_id": "ipip-neo-300-094",
		"domain": "E",
		"facet": "E4",
		"keying": "plus"
	},
	{
		"item_id": "ipip-neo-300-095",
		"domain": "E",
		"facet": "E4",
		"keying": "plus"
	},
	{
		"item_id": "ipip-neo-300-096",
		"domain": "E",
		"facet": "E4",
		"keying": "minus"
	},
	{
		"item_id": "ipip-neo-300-097",
		"domain": "E",
		"facet": "E4",
		"keying": "minus"
	},
	{
		"item_id": "ipip-neo-300-098",
		"domain": "E",
		"facet": "E4",
		"keying": "minus"
	},
	{
		"item_id": "ipip-neo-300-099",
		"domain": "E",
		"facet": "E4",
		"keying": "minus"
	},
	{
		"item_id": "ipip-neo-300-100",
		"domain": "E",
		"facet": "E4",
		"keying": "minus"
	},
	{
		"item_id": "ipip-neo-300-101",
		"domain": "E",
		"facet": "E5",
		"keying": "plus"
	},
	{
		"item_id": "ipip-neo-300-102",
		"domain": "E",
		"facet": "E5",
		"keying": "plus"
	},
	{
		"item_id": "ipip-neo-300-103",
		"domain": "E",
		"facet": "E5",
		"keying": "plus"
	},
	{
		"item_id": "ipip-neo-300-104",
		"domain": "E",
		"facet": "E5",
		"keying": "plus"
	},
	{
		"item_id": "ipip-neo-300-105",
		"domain": "E",
		"facet": "E5",
		"keying": "plus"
	},
	{
		"item_id": "ipip-neo-300-106",
		"domain": "E",
		"facet": "E5",
		"keying": "plus"
	},
	{
		"item_id": "ipip-neo-300-107",
		"domain": "E",
		"facet": "E5",
		"keying": "plus"
	},